,Name,Description,Price,Rating,Rating_Count,URL
74,Mivi,"Mivi DuoPods A850 [Just Launched] AI-ENC TWS with HDCalls Technology,13mm Rich Bass Drivers,50Hrs Playtime,Low Latency,Type C Fast Charging,Clear Audio Quality,Made in India Earbuds-GalaxyBlack","₹1,599",3.7,,https://www.amazon.in/Mivi-Launched-Technology-Playtime-Earbuds-GalaxyBlack/dp/B0C89M52Y6/ref=sr_1_77?keywords=earpods&qid=1692426311&sr=8-77
75,Mivi,"Mivi DuoPods A550 Truly Wireless in Ear Earbuds with Quad Mic ENC(Environmental Noise Cancellation), 13mm Powerful Bass Drivers, 50+ Hours of Playtime, High Audio Quality, Metallic Design (Black)","₹1,399",3.6,,https://www.amazon.in/Mivi-Wireless-Environmental-Cancellation-Powerful/dp/B0B4JH5PG8/ref=sr_1_78?keywords=earpods&qid=1692426311&sr=8-78
76,JBL,"JBL Wave Beam in-Ear Earbuds (TWS) with Mic, App for Customized Extra Bass EQ, 32 Hours Battery and Quick Charge, IP54 Water & Dust Resistance, Ambient Aware & Talk-Thru, Google FastPair (Mint)","₹3,949",3.7,,https://www.amazon.in/JBL-Customized-Resistance-Talk-Thru-FastPair/dp/B0BV9ZRNW6/ref=sr_1_79?keywords=earpods&qid=1692426311&sr=8-79
77,Sony,"Sony WF-C700N Bluetooth Truly Wireless Lightest Active Noise Cancellation in Ear Earbuds, Multipoint Connection, 10 mins Super Quick Charge, 20hrs Batt, IPX4 Ratings, Fast Pair,App Support-Lavender","₹8,990",4.2,,https://www.amazon.in/Sony-WF-C700N-Cancellation-Multipoint-Support-Lavender/dp/B0C9ZYSJSK/ref=sr_1_80?keywords=earpods&qid=1692426311&sr=8-80
78,PTron,"PTron Newly Launched Bassbuds Sports V3 Wireless in-Ear TWS Earbuds with Mic, TruTalk AI-ENC Stereo Calls, Game/Music Modes, 36Hrs Playtime, BT5., Type-C Fast Charging & IPX5 Water Resistant (Blue)","₹1,099",3.2,,https://www.amazon.in/Launched-Bassbuds-Wireless-Playtime-Resistant/dp/B0C1PXD6VZ/ref=sr_1_81?keywords=earpods&qid=1692426311&sr=8-81
79,Boult,"Boult Newly Launched Ammo True Wireless In Ear Earbuds with 40ms Lowest Latency, 40H Playtime, ENC Mic, Made in India, 13mm Bass Drivers, Interactive LEDs, Type-C Fast Charging (10Min=150min) Ear Buds","₹1,399",3.8,,https://www.amazon.in/Boult-Launched-Wireless-Playtime-Interactive/dp/B0BXFC8BMW/ref=sr_1_82?keywords=earpods&qid=1692426311&sr=8-82
80,Skullcandy,Skullcandy Jib True 2 Wireless in-Ear Earbuds - Chill Gray,"₹3,298",3.4,,https://www.amazon.in/Skullcandy-True-Wireless-Earbuds-Chill/dp/B09VM6ZRDK/ref=sr_1_83?keywords=earpods&qid=1692426312&sr=8-83
81,boAt,"boAt Airdopes Max TWS Earbuds with 100 HRS Playtime, Quad Mics with ENx™ Tech, Beast™ Mode(50ms Low Latency), ASAP™ Charge, Bluetooth v5.3 and IWP™(Carbon Black)","₹1,299",3.1,,https://www.amazon.in/boAt-Airdopes-Max-Playtime-Bluetooth/dp/B0C7CNFKJ3/ref=sr_1_84?keywords=earpods&qid=1692426312&sr=8-84
82,JBL,"JBL Wave Buds in-Ear Earbuds (TWS) with Mic,App for Customized Extra Bass Eq,32 Hours Battery&Quick Charge,Ip54 Water&Dust Resistance,Ambient Aware&Talk-Thru,Google Fastpair (Black),Wireless","₹3,299",3.7,,https://www.amazon.in/JBL-Customized-Resistance-Talk-Thru-FastPair/dp/B0BHDMHHM9/ref=sr_1_85?keywords=earpods&qid=1692426312&sr=8-85
83,JLab,"JLab Go Air Pop True Wireless Bluetooth Earbuds + Charging Case Dual Connect Ipx4 Sweat Resistance Bluetooth 5.1 Connection 3 Eq Sound Settings Signature, Balanced, Bass (Rose)","₹1,799",4.3,,https://www.amazon.in/JLab-Unisex-Adult-Bluetooth-Resistance-Connection/dp/B09HN46PXL/ref=sr_1_86?keywords=earpods&qid=1692426312&sr=8-86
84,PTron,"PTron Bassbuds Duo in Ear Earbuds with 32Hrs Total Playtime, Bluetooth 5.1 Wireless Headphones, Stereo Audio, Touch Control TWS, with Mic, Type-C Fast Charging, IPX4 & Voice Assistance (White)",₹799,3.4,,https://www.amazon.in/Bassbuds-Duo-Headphones-Water-Resistant-Assistance/dp/B09DDBN1YH/ref=sr_1_87?keywords=earpods&qid=1692426312&sr=8-87
85,Boult,"Boult Audio Z25 with 32H Playtime, 45ms Low Latency, Type-C Fast Charging (10=150Mins), 13mm Rich Bass Drivers, Zen ENC Mic, TWS Bluetooth 5.3 True Wireless Airbass in Ear Earbuds (Blue Moss)","₹1,299",3.7,,https://www.amazon.in/Boult-Wireless-Playtime-Charging-Bluetooth/dp/B0BLHL74S7/ref=sr_1_88?keywords=earpods&qid=1692426312&sr=8-88
86,realme,"realme Buds Air 3 True Wireless in-Ear Earbuds with 42dB Active Noise Cancellation (ANC), Dual Device Pairing and 30 hrs Playtime with Fast Charging (Starry Blue)","₹3,999",4.0,,https://www.amazon.in/realme-Wireless-Cancellation-Playtime-Charging/dp/B0B8H61SR4/ref=sr_1_89?keywords=earpods&qid=1692426312&sr=8-89
87,truke,"truke Newly Launched BTG Beta True Wireless in Ear Earbuds with 13mm Big Speaker Drivers,38H Playtime,Fast Charging,True Gaming Mode,Instant Pairing,AAC Codec,Dual-Mic ENC,Bluetooth 5.3, IPX4Â(White)",₹799,3.5,,https://www.amazon.in/Technology-Playtime-Dual-Mic-Speakers-Bluetooth/dp/B0B3MWCB78/ref=sr_1_90?keywords=earpods&qid=1692426312&sr=8-90
88,ZEBRONICS,"ZEBRONICS Pods 2 Wireless TWS Earbuds with Bluetooth 5.3,Led Display,Voice Assistant,Call Function,Transparent Charging Case,Touch Control&Built-in Rechargeable Battery-Neon,in-Ear",₹699,3.5,,https://www.amazon.in/ZEBRONICS-Pods-Transparent-Rechargeable-Battery-Neon/dp/B0BYJN986V/ref=sr_1_91?keywords=earpods&qid=1692426312&sr=8-91
89,boAt,"boAt Airdopes 413ANC True Wireless in Ear Earbuds with Active Noise Cancellation, 2 Mics ENx Tech, Signature Sound, Touch Gesture, 20 Hours Playback, ASAP Charge & Ambient Mode(Verve Purple)","₹1,999",3.8,,https://www.amazon.in/boAt-Airdopes-413ANC-Cancellation-Signature/dp/B0BV5Y6D9P/ref=sr_1_92?keywords=earpods&qid=1692426312&sr=8-92
90,M19,M19 Wireless In Ear Earbuds TWS 5.1 Large Screen Dual LED Digital Display Touch Bluetooth Headphones Mini Compact Portable Sports Waterproof Stereo Earphones,₹408,3.2,,https://www.amazon.in/Wireless-Bluetooth-Headphones-Waterproof-Earphones/dp/B0BRT2JZWV/ref=sr_1_93?keywords=earpods&qid=1692426312&sr=8-93
91,Boult,"Boult Audio Newly Launched Z25 with 32H Playtime, 45ms Low Latency, Type-C Fast Charging (10=150Mins), 13mm Rich Bass Drivers, Zen ENC Mic, BT 5.3 True Wireless Airbass in Ear Earbuds (Sunset Grey)","₹1,299",3.7,,https://www.amazon.in/Boult-Wireless-Playtime-Charging-Bluetooth/dp/B0BLHKBFLK/ref=sr_1_94?keywords=earpods&qid=1692426312&sr=8-94
92,Boult,"Boult Audio Maverick Truly Wireless in Ear Earbuds with 35H Playtime, Quad Mic ENC, 45ms Xtreme Low Latency, Gaming LEDs, Made in India, 10mm Bass Drivers, Type-C Fast Charging Bluetooth 5.3 Ear Buds","₹1,499",3.8,,https://www.amazon.in/Boult-Audio-Maverick-Wireless-Bluetooth/dp/B0BBGJPX7X/ref=sr_1_95?keywords=earpods&qid=1692426312&sr=8-95
93,PTron,"PTron Bassbuds Plus in Ear True Wireless Stereo Earbuds with Mic, Deep Bass Bluetooth Headphones, Voice Assistance, IPX4 Sweat & Water Resistant TWS, 12Hrs Battery & Fast Charge (Black)",₹699,3.4,,https://www.amazon.in/Bassbuds-Plus-Bluetooth-Headphones-Resistant/dp/B08S19YC6H/ref=sr_1_96?keywords=earpods&qid=1692426312&sr=8-96
94,MARVIK,"MARVIK M10 True Wireless Earbuds Bluetooth 5.1 with Waterproof Bluetooth Earphones with Mic, Noise-Cancellation, Auto Pairing Bluetooth Headset",₹499,3.3,,https://www.amazon.in/MARVIK-M10-Bluetooth-Waterproof-Noise-Cancellation/dp/B0C5RD1VPF/ref=sr_1_97?keywords=earpods&qid=1692426312&sr=8-97
95,JBL,"JBL Tune 230NC TWS, Active Noise Cancellation Earbuds with Mic, Massive 40 Hrs Playtime with Speed Charge, Adjustable EQ APP, 4Mics for Perfect Calls, Google Fast Pair, Bluetooth 5.2 (Black)","₹5,966",3.7,,https://www.amazon.in/JBL-Cancellation-Playtime-Adjustable-Bluetooth/dp/B09HGR1DVC/ref=sr_1_98?keywords=earpods&qid=1692426312&sr=8-98
96,PTron,"PTron Bassbuds Plus in-Ear TWS Earbuds with HD Mics, Bluetooth 5.0 Headphones with Immersive Sound, Stereo Calls, 28Hrs Playtime, Voice Assist Ready, IPX4 Water Resistant & Fast Charge (Raging Red)",₹699,4.2,,https://www.amazon.in/Bassbuds-Bluetooth-Headphones-Immersive-Resistant/dp/B0C7S9WYSC/ref=sr_1_99?keywords=earpods&qid=1692426313&sr=8-99
97,Noise,"Noise Newly Launched Buds VS401 in-Ear Truly Wireless Earbuds with 50H of Playtime, Low Latency(up-to 50ms), Quad Mic with ENC, Instacharge(10 min=200 min),10mm Driver, BT v5.3(Jet Black)","₹1,399",3.7,,https://www.amazon.in/Noise-Launched-Wireless-Playtime-Instacharge/dp/B0C24HGHSF/ref=sr_1_100?keywords=earpods&qid=1692426313&sr=8-100
98,Noise,"Noise Buds Connect Truly Wireless in Ear Earbuds with 50H Playtime, Quad Mic with ENC, Instacharge(10 min=120 min), 13mm Driver, Hyper Sync, and BT v5.2 (Ivory White)","₹1,499",3.7,,https://www.amazon.in/Noise-Launched-Wireless-Playtime-Instacharge/dp/B0BJ7C34YM/ref=sr_1_101?keywords=earpods&qid=1692426313&sr=8-101
99,Samsung,"Samsung Galaxy Buds Live Bluetooth Truly Wireless in Ear Earbuds with Mic, Upto 21 Hours Playtime, Mystic Black",,3.9,,https://www.amazon.in/Samsung-Bluetooth-Wireless-Earbuds-Playtime/dp/B08FN6WGDQ/ref=sr_1_102?keywords=earpods&qid=1692426313&sr=8-102
100,Boult,"Boult Audio Newly Launched X10 Pro TWS Earbuds with 45H Playtime, Quad Clear Calling ENC Mic, 50ms Xtreme Low Latency Gaming Mode, 10mm Rich Bass Drivers, Type-C Fast Charging, BT 5.3 Ear Buds (Green)","₹1,399",4.0,,https://www.amazon.in/Boult-Audio-Launched-Playtime-Charging/dp/B0C77ZV61Z/ref=sr_1_103?keywords=earpods&qid=1692426313&sr=8-103
101,truke,"truke Buds F1 True Wireless in Ear Earbuds with 38H Playtime, Instant Paring, Exceptional Sound with AAC Codec, Dual Mic ENC, Digital Display, 55ms Low Latency Gaming Mode, BT 5.3 (Black)",₹799,3.8,,https://www.amazon.in/Launched-Wireless-Earbuds-Playtime-Exceptional/dp/B09YTYJDR1/ref=sr_1_104?keywords=earpods&qid=1692426313&sr=8-104
102,Wings,"Wings Phantom 340 Best Low Latency 40ms Earbuds, Sync App Support, Ergonomically Designed Case, 50 Hours Playtime, Quad ENC Mic, Touch Controls.","₹1,999",3.7,,https://www.amazon.in/Wings-Ergonomically-Designed-Playtime-Controls/dp/B0BVBVBNL3/ref=sr_1_105?keywords=earpods&qid=1692426313&sr=8-105
103,Boult,"Boult Audio Newly Launched Z60 Truly Wireless in Ear Earbuds with 60H Playtime, Quad Mic ENC Clear Calling, 50ms Low Latency Gaming, IPX5 Ear Buds TWS, Bluetooth 5.3, 13mm Bass Drivers (Powder Blue)","₹1,599",4.0,,https://www.amazon.in/Boult-Audio-Launched-Wireless-Bluetooth/dp/B0CBTXJJZH/ref=sr_1_106?keywords=earpods&qid=1692426313&sr=8-106
104,Sony,"Sony WF-C500 Truly Wireless Bluetooth Earbuds with 20Hrs Battery, True Wireless Earbuds with Mic for Phone Calls, Quick Charge, Fast Pair, 360 Reality Audio, Upscale Music - DSEE, App Support - Black","₹5,348",4.1,,https://www.amazon.in/Sony-WF-C500-Bluetooth-Wireless-transactions/dp/B09PC695Q9/ref=sr_1_107?keywords=earpods&qid=1692426313&sr=8-107
105,ZEBSTER,"ZEBSTER Duo 2 TWS Earbuds with Bluetooth 5.1,Voice Assistant Support,Call Function,Sporty&Splash Proof Design,Upto 6.5H* Playback Time(Black),in-Ear",₹599,3.1,,https://www.amazon.in/ZEBSTER-Z-DUO-2-Z-Duo-Earbuds/dp/B09ZVC431D/ref=sr_1_108?keywords=earpods&qid=1692426313&sr=8-108
106,Amazon,"Amazon Basics True Wireless in-Ear Earbuds with Mic, Touch Control, IPX5 Water-Resistance, Bluetooth 5.3, Up to 40 Hours Play Time, Voice Assistance and Fast Charging (Blue)",₹999,5.0,,https://www.amazon.in/Wireless-Water-Resistance-Bluetooth-Assistance-Charging/dp/B0CD21MZZV/ref=sr_1_109?keywords=earpods&qid=1692426313&sr=8-109
107,Wings,"Wings Phantom 850 Low Latency Wireless Earbuds, Bluetooth Headphones with App Support, Split Cover Gaming Case with LED Lights, 50 Hours Playtime,Quad ENC Mic, Touch Controls TWS Headsets","₹1,499",4.0,,https://www.amazon.in/Wings-Wireless-Bluetooth-Headphones-Playtime/dp/B0BMDV9YYH/ref=sr_1_110?keywords=earpods&qid=1692426313&sr=8-110
108,Mivi,"Mivi DuoPods A650 True Wireless in Ear Earbuds with Quad Mic ENC, 13mm Rich Bass Drivers, 55Hrs Playtime, Low Latency, Fast Charging, Clear Audio Quality, Made in India (Zed Black)","₹1,499",3.8,,https://www.amazon.in/Mivi-DuoPods-Wireless-Playtime-Charging/dp/B0C1YRCF5Y/ref=sr_1_111?keywords=earpods&qid=1692426313&sr=8-111
109,truke,"truke Newly Launched BTG Storm Gaming Earbuds with 40ms Ultra-Low Latency, 13mm Titanium Drivers, ENC, 50H Playtime, Fast Charge, BT 5.3, IPX5 (Black)",₹999,4.0,,https://www.amazon.in/truke-Launched-Ultra-Low-Titanium-Playtime/dp/B0C1P3C5QQ/ref=sr_1_112?keywords=earpods&qid=1692426313&sr=8-112
110,boAt,"boAt Airdopes Fuel in Ear Headphones,Quad Mics,Enx Tech,Beast Mode,50H Playtime,ASAP Charge,Ipx4,Iwp,Touch Controls(Classic Black),Bluetooth","₹1,699",3.7,,https://www.amazon.in/boAt-Airdopes-Fuel-Classic-Black/dp/B0BL7TT2JR/ref=sr_1_113?keywords=earpods&qid=1692426313&sr=8-113
111,OnePlus,"OnePlus Bullets Z2 Bluetooth Wireless in Ear Earphones with Mic, Bombastic Bass - 12.4 Mm Drivers, 10 Mins Charge - 20 Hrs Music, 30 Hrs Battery Life (Magico Black)","₹1,999",4.2,,https://www.amazon.in/Oneplus-Bluetooth-Wireless-Earphones-Bombastic/dp/B09TVVGXWS/ref=sr_1_114?keywords=earpods&qid=1692426313&sr=8-114
112,Blaupunkt,Blaupunkt Newly Launched BTW20 Bluetooth Truly Wireless In Ear Earbuds with Deep Bass I 30 Hrs Playtime* I Built in Mic I LED Digital Battery Display I TurboVolt Charging I IPX5 Sweat Resistant(Black),₹999,3.1,405,https://www.amazon.in/Blaupunkt-BTW20-Bluetooth-TurboVolt-Resistant/dp/B0BL18H9ZS/ref=sr_1_115?keywords=earpods&qid=1692426316&sr=8-115
113,CrossBeats,"CrossBeats Neopods 300 TWS in Ear Earbuds with Gaming Mode, 40 Hours of Playtime, Quad mic ENC,13mm Drivers Bluetooth Wireless Earphones, Type c Fast Charging, IPX4 Water Resistance- Black","₹1,099",3.9,91,https://www.amazon.in/CrossBeats-Playtime-Bluetooth-Earphones-Resistance/dp/B0C789M6BN/ref=sr_1_116?keywords=earpods&qid=1692426316&sr=8-116
114,PTron,"PTron Bassbuds Tango ENC Bluetooth Truly Wireless in Ear Earbuds with mic, Movie Mode, 40Hrs Playtime, Bluetooth Headphones 5.1, Deep Bass, Touch Control TWS Earbuds & Type-C Fast Charging (Black)",₹997,3.8,"5,049",https://www.amazon.in/Bassbuds-Tango-Environmental-Cancellation-Headphones/dp/B09KYDNSHC/ref=sr_1_117?keywords=earpods&qid=1692426316&sr=8-117
115,PTron,"PTron Newly Launched Bassbuds Zen in-Ear Wireless TWS Earbuds with Quad ENC Mic TruTalk, 50Hrs Playtime, Bluetooth Headphone 5.3 with Mic, Deep Bass, Touch Control, Type-C Fast Charging & IPX4 (Grey)","₹1,199",4.2,537,https://www.amazon.in/Launched-Bassbuds-Wireless-Bluetooth-Headphone/dp/B0C546CPLS/ref=sr_1_118?keywords=earpods&qid=1692426316&sr=8-118
116,OnePlus,"OnePlus Buds Z2 Bluetooth Truly Wireless in Ear Earbuds with mic, Active Noise Cancellation, 10 Minutes Flash Charge & Upto 38 Hours Battery (Pearl White)","₹4,999",4.2,"7,057",https://www.amazon.in/OnePlus-Wireless-Earbuds-Active-Cancellation/dp/B07XWB82D9/ref=sr_1_119?keywords=earpods&qid=1692426316&sr=8-119
117,truke,"truke Newly Launched Buds Vibe True Wireless in Ear Earbuds with 35dB Real ANC + Quad Mic ENC, 13mm Big Speaker, 4 EQ Modes, 48H Playtime, Fast Charge, 40ms Low Latency, AAC Codec, BT 5.3, IPX5(Black)","₹1,499",3.9,"1,991",https://www.amazon.in/truke-Launched-Wireless-Earbuds-Playtime/dp/B0BSLRGRJL/ref=sr_1_120?keywords=earpods&qid=1692426316&sr=8-120
118,OnePlus,"OnePlus Nord Buds 2r True Wireless in Ear Earbuds with Mic, 12.4mm Drivers, Playback:Upto 38hr case,4-Mic Design, IP55 Rating [Triple Blue]- @INR 1999 with Bank Offer","₹2,199",4.2,"37,725",https://www.amazon.in/OnePlus-Wireless-Earbuds-Drivers-Playback/dp/B0C8J93L26/ref=sr_1_121?keywords=earpods&qid=1692426316&sr=8-121
119,pTron,"pTron Bassbuds Perl In-Ear TWS Earbuds with AI-TruTalk ENC Calls, Immersive Sound, 28Hrs Playtime, Music/Game Modes, BT5.3 Wireless Headphones, Pinch Touch Control, Type-C Fast Charging & IPX4 (Black)",₹999,3.7,24,https://www.amazon.in/pTron-Bassbuds-AI-TruTalk-Immersive-Headphones/dp/B0C74RBT5V/ref=sr_1_122?keywords=earpods&qid=1692426316&sr=8-122
120,Noise,"Noise Buds VS104 Pro Truly Wireless in Ear Earbuds with 40H of Playtime, Quad Mic with ENC, Instacharge(10 min=150 min), 14.2mm Driver, Hyper Sync, BT v5.3 (Snow White)","₹1,599",3.6,"3,599",https://www.amazon.in/Noise-Wireless-40-Hours-Playtime-Instacharge/dp/B0B97CW75N/ref=sr_1_123?keywords=earpods&qid=1692426316&sr=8-123
121,truke,"truke Newly Launched BTG Neo Dual Pairing Earbuds with 6-Mic Advanced ENC, 80H Playtime, 35ms Ultra-Low Latency, 13mm Titanium Drivers, 3 EQ Modes, Fast Charge, Instant Pairing, Bluetooth 5.3, IPX5","₹1,499",4.1,739,https://www.amazon.in/truke-Launched-Advanced-Ultra-Low-Bluetooth-5-3/dp/B0C788NJSK/ref=sr_1_124?keywords=earpods&qid=1692426316&sr=8-124
122,Fireboltt,"Fireboltt Fire Pods Vega 811 TWS earbuds with captivating RGB lights, Bluetooth 5.3, Gaming Mode, Quad Mic ENC, and voice assistance (Grey Blue)","₹1,799",3.6,9,https://www.amazon.in/Fireboltt-earbuds-captivating-Bluetooth-assistance/dp/B0C6DZV2SC/ref=sr_1_125?keywords=earpods&qid=1692426316&sr=8-125
123,Apple,Apple AirPods (3rd Generation),"₹19,600",4.2,"1,965",https://www.amazon.in/Apple-MME73HN-A-AirPods-3rd-Generation/dp/B09JRDN6PL/ref=sr_1_126?keywords=earpods&qid=1692426316&sr=8-126
124,Noise,"Noise Buds Connect Truly Wireless in Ear Earbuds with 50H Playtime, Quad Mic with ENC, Instacharge(10 min=120 min), 13mm Driver, Hyper Sync, and BT v5.2 (Carbon Black)","₹1,499",3.7,"1,753",https://www.amazon.in/Noise-Launched-Wireless-Playtime-Instacharge/dp/B0BJ7CY6J8/ref=sr_1_127?keywords=earpods&qid=1692426316&sr=8-127
125,Cosmic,"Cosmic Byte CosmoBuds X200 True Wireless Earbuds (TWS), BT 5.3, 38ms Latency GOD Mode™, Music Mode, 40Hrs, ENC, IPX5, Voice Assistant (Black)","₹1,422",3.9,372,https://www.amazon.in/Cosmic-Byte-CosmoBuds-X200-Assistant/dp/B0BWKCX8FL/ref=sr_1_128?keywords=earpods&qid=1692426316&sr=8-128
126,boAt,"boAt Airdopes 393ANC True Wireless in Ear Earbuds with 32dB Hybrid ANC, Quad Mics with ENx™ Tech, 30 Hours Playback, Beast™ Mode,ASAP™ Charge,Ambient Mode,Bluetooth v5.2 IWP™,IPX5(Rogue Black)","₹1,999",3.5,961,https://www.amazon.in/boAt-Airdopes-393ANC-Wireless-Bluetooth/dp/B0BJKFY1W1/ref=sr_1_129?keywords=earpods&qid=1692426316&sr=8-129
127,Mivi,"Mivi DuoPods A350 True Wireless Earbuds with 50hrs Playtime, Half in Ear, 13mm Dynamic bass Drivers, Fast Charging, Metallic Shades, Made in India Bluetooth Earphone, TWS with Voice Assistant - Green",₹999,3.3,"7,619",https://www.amazon.in/Mivi-Earbuds-Playtime-Wireless-Assistant-Green/dp/B0B2PJN2W7/ref=sr_1_130?keywords=earpods&qid=1692426316&sr=8-130
